{
  "candidate": {
    "canonicalization": "canonical_json_v1",
    "input_mode": "structured_json",
    "privacy_policy_id": "privacy.no_secrets_v1",
    "schema_digest": "sha256:16293656528fb1b5732d0b67911f0335026e90bdfb086abafb495267a62f9f17",
    "schema_ref": "fixture://schemas/fixture-append-candidate.v1"
  },
  "canonical_result": {
    "authority_rule": "authority.append_head_v1",
    "locator_template": "streams/{stream_id}.jsonl",
    "owner_id": "fixture.append.owner",
    "result_reference_schema_ref": "https://phase-tool.local/schemas/phase-result-reference.schema.json",
    "result_schema_digest": "sha256:33587c74cca0e78e8a5e56a7f139297fdca572f500c8e292c169a66951e4d4ee",
    "result_schema_ref": "fixture://schemas/fixture-append-result.v1",
    "root_binding": "fixture_result_root"
  },
  "evidence": {
    "receipt_schema_digest": "sha256:b68327ee676e8a51fabbd231e66ed5b3195171c9a169207a03782700892834bf",
    "receipt_schema_ref": "https://phase-tool.local/schemas/phase-receipt.schema.json",
    "redaction_policy_id": "redaction.no_secrets_v1",
    "required_attachment_kinds": [
      "effect_receipts",
      "validator_results"
    ],
    "retention_policy_id": "retention.fixture_v1"
  },
  "idempotency": {
    "incomplete_previous_execution": "inspect_before_retry",
    "key_required": true,
    "request_digest_policy_id": "digest.canonical_request_v1",
    "same_key_different_digest": "conflict",
    "same_key_same_digest": "return_existing_verified",
    "scope_fields": [
      "contract",
      "result_locator",
      "operation_intent"
    ],
    "success_lookup": "canonical_result_then_receipt"
  },
  "identity": {
    "core_compatibility": {
      "maximum_exclusive": "2.0.0",
      "minimum": "1.0.0"
    },
    "id": "fixture_append.v1",
    "version": "1.0.0"
  },
  "input_bindings": [
    {
      "freeze_strategy": "lock_snapshot_revalidate",
      "id": "current_state",
      "mutable_upstream_after_freeze": "allowed_with_revalidation",
      "provenance_required": false,
      "required": false,
      "schema_digest": null,
      "schema_ref": null
    }
  ],
  "operation": {
    "allowed_effects": [
      "exclusive_create",
      "append_record"
    ],
    "atomicity_claim": "per_effect",
    "effect_order": "static_predeclared",
    "intent": "append",
    "maximum_effects": 2,
    "mechanism": {
      "availability": "bundled_v1",
      "capability": "mutation_mechanism",
      "id": "mechanism.expected_head_append_v1",
      "package_digest": "sha256:9d69f2b6f68866c35e78bfa1a6ddce912f21a55c42d34d2ebc689d3bf0f4d0c1",
      "version": "1.0.0"
    }
  },
  "outcomes": {
    "committed_unverified": "committed_unverified",
    "known_no_effect": "failed_no_effect",
    "known_partial": "failed_partial",
    "pre_mutation_rejection": "rejected",
    "success": "succeeded_verified",
    "unknown_result": "indeterminate"
  },
  "phase_contract_version": "1.0",
  "recovery": {
    "automatic": false,
    "policy": "none",
    "requires_exact_before_state": false
  },
  "validators": [
    {
      "binding": {
        "capability": "validator",
        "id": "validator.exact_binding_v1",
        "package_digest": "sha256:19f8b652b094e3079226d506bc6111ae8124e35807e54183e23d95bb13188bb3",
        "version": "1.0.0"
      },
      "blocking": true,
      "config": {},
      "phase": "contract"
    },
    {
      "binding": {
        "capability": "validator",
        "id": "fixture.append.candidate_v1",
        "package_digest": "sha256:d6dbd3dff45443b8083a324d3231988f703916bff0ed76e757041ffbde1605fb",
        "version": "1.0.0"
      },
      "blocking": true,
      "config": {},
      "phase": "candidate"
    },
    {
      "binding": {
        "capability": "validator",
        "id": "validator.expected_head_v1",
        "package_digest": "sha256:0235f53aac0f4581a44d5d3e8b985780a994439d35985c3c4159fefca2e0ccd0",
        "version": "1.0.0"
      },
      "blocking": true,
      "config": {},
      "phase": "pre_operation"
    },
    {
      "binding": {
        "capability": "validator",
        "id": "validator.valid_tail_v1",
        "package_digest": "sha256:2c41a18f0daf88a0b70d9cbf137fd02f7614a6158edf0e07df1b2c4f2e81e05d",
        "version": "1.0.0"
      },
      "blocking": true,
      "config": {},
      "phase": "pre_operation"
    },
    {
      "binding": {
        "capability": "validator",
        "id": "validator.result_digest_v1",
        "package_digest": "sha256:fe1ec09ae9e0162090b2908feba7e51b293ac62e2a6a2f963aef4a9690592372",
        "version": "1.0.0"
      },
      "blocking": true,
      "config": {},
      "phase": "post_operation"
    }
  ],
  "verification": {
    "observation_scope": "historical_observation",
    "required_predicates": [
      "valid_record_boundary",
      "expected_record_present",
      "head_matches"
    ],
    "validators": [
      {
        "capability": "validator",
        "id": "validator.valid_tail_v1",
        "package_digest": "sha256:2c41a18f0daf88a0b70d9cbf137fd02f7614a6158edf0e07df1b2c4f2e81e05d",
        "version": "1.0.0"
      },
      {
        "capability": "validator",
        "id": "validator.result_digest_v1",
        "package_digest": "sha256:fe1ec09ae9e0162090b2908feba7e51b293ac62e2a6a2f963aef4a9690592372",
        "version": "1.0.0"
      }
    ]
  },
  "write_scope": {
    "default_path_policy": {
      "capability": "path_policy",
      "id": "path.strict_local_v1",
      "package_digest": "sha256:238b3431352a94dab33ffa0190fd78cd2825679377cb0e14dfa4bd4c6da8b0f4",
      "version": "1.0.0"
    },
    "forbidden_root_bindings": [
      "phase_evidence_root"
    ],
    "roots": [
      {
        "access": "write",
        "binding_id": "fixture_result_root",
        "path_policy": {
          "capability": "path_policy",
          "id": "path.strict_local_v1",
          "package_digest": "sha256:238b3431352a94dab33ffa0190fd78cd2825679377cb0e14dfa4bd4c6da8b0f4",
          "version": "1.0.0"
        },
        "reparse_policy": "reject",
        "symlink_policy": "reject"
      }
    ]
  }
}
